score,class,case,Topic,,Title,URL
,,,,,Your personal data may be disclosed to comply with government requests without notice to you,https://edit.tosdr.org/cases/164
,,,,,Your personal data may be sold or otherwise transferred as part of a bankruptcy proceeding or other type of financial transaction,https://edit.tosdr.org/cases/243
,,,,,Your Personal data may be sold unless you opt out,https://edit.tosdr.org/cases/396
,,,,,Your personal data may be used for marketing purposes,https://edit.tosdr.org/cases/336
,,,,,Your personal data will not be used for an automated decision-making,https://edit.tosdr.org/cases/480
,,,,,Your personal information is used for many different purposes,https://edit.tosdr.org/cases/185
,,,,,Your private content may be accessed by people working for the service,https://edit.tosdr.org/cases/189
,,,,,Your profile is combined across various products,https://edit.tosdr.org/cases/326
,,,,,Your provided identifiable information is actively checked by the service,https://edit.tosdr.org/cases/492
,,,,,Your use is throttled,https://edit.tosdr.org/cases/157